{
  "values": [
    {
      "description": "The clusters name something conducting or constituting an intrusion: an actor, a campaign, a malware family, a tool. The dividing line is curation rather than menace - a curated list of firms selling intrusion capability belongs here, a directory of every agency that exists does not.",
      "value": "named-threat"
    },
    {
      "description": "The clusters describe adversary behaviour - where in an intrusion, and how. Attack patterns, techniques and tactics.",
      "value": "technique"
    },
    {
      "description": "The clusters describe who was hit: a sector, a place, a target description.",
      "value": "victim"
    },
    {
      "description": "The clusters describe what to do about it: courses of action, mitigations, countermeasures, controls.",
      "value": "defensive"
    },
    {
      "description": "The clusters describe how something would be caught: detection rules, analytics, detection strategies, data sources.",
      "value": "detection"
    },
    {
      "description": "The clusters describe what is exposed: assets, platforms, services.",
      "value": "targeting"
    },
    {
      "description": "The clusters name entities that appear alongside threat intelligence without being a threat themselves - who published a report, a vendor, a branded vulnerability, a reference list of sources.",
      "value": "context"
    },
    {
      "description": "The clusters are a reference list from another domain, carried in MISP for sharing rather than to describe an intrusion - an industry classification, a species list, an equipment catalogue.",
      "value": "reference"
    }
  ],
  "version": 1,
  "description": "What concept a galaxy's clusters represent, so that a consumer can ask for the galaxies naming a threat - or the ones describing behaviour, or victims - without hardcoding a list of galaxy names. Set on the galaxy definition, not on the cluster.",
  "source": "MISP Project",
  "author": [
    "MISP Project"
  ],
  "uuid": "f83dbc80-a2df-4232-82ce-0cd59371b0eb",
  "type": "galaxy-category-vocabulary"
}
