{
  "values": [
    {
      "description": "Under named-threat: the clusters name who conducts intrusions - threat actor groups, intrusion sets, and curated lists of entities operating or selling intrusion capability.",
      "value": "actor"
    },
    {
      "description": "Under named-threat: the clusters name a bounded piece of intrusion activity - a campaign, an operation, a documented incident or case study against a specific target.",
      "value": "campaign"
    },
    {
      "description": "Under named-threat: the clusters name malicious software families - ransomware, RATs, stealers, bankers, botnets, wipers and the like.",
      "value": "malware"
    },
    {
      "description": "Under named-threat: the clusters name software or services used in intrusions without being malware by design - dual-use and remote management tools, exploit kits, traffic distribution systems.",
      "value": "tool"
    },
    {
      "description": "Under technique: ATT&CK-shaped techniques whose clusters carry a kill_chain element naming their tactic, so they can be rolled up by tactic. A property of the sub-category, not something to infer from kill_chain_order.",
      "value": "attack-pattern"
    },
    {
      "description": "Under technique: techniques from a framework with its own tactic vocabulary - DISARM, AM!TT, SPARTA, fraud frameworks and the like - which do not belong on one tactic strip with ATT&CK.",
      "value": "technique"
    },
    {
      "description": "Under technique: the clusters are the tactics themselves - the phases or goals of an intrusion - rather than the techniques used to reach them.",
      "value": "tactic"
    },
    {
      "description": "Under victim: the clusters name an activity sector or industry that was hit.",
      "value": "sector"
    },
    {
      "description": "Under victim: the clusters name a place that was hit - a country or a region.",
      "value": "location"
    },
    {
      "description": "Under victim: the clusters describe what was targeted when it is neither a sector nor a place - a kind of target or of targeted information.",
      "value": "target"
    },
    {
      "description": "Under defensive: the clusters are courses of action, mitigations and countermeasures addressing specific adversary behaviour.",
      "value": "course-of-action"
    },
    {
      "description": "Under defensive: the clusters are controls or requirements from a security control catalogue or assurance framework, not tied to a specific technique.",
      "value": "control"
    },
    {
      "description": "Under detection: the clusters are detection rules ready to run against data - Sigma rules and the like.",
      "value": "rule"
    },
    {
      "description": "Under detection: the clusters are analytics and detection strategies - how a behaviour would be caught, rather than a rule ready to run.",
      "value": "strategy"
    },
    {
      "description": "Under detection: the clusters name the data sources and data components a detection reads from.",
      "value": "data-source"
    },
    {
      "description": "Under targeting: the clusters name devices, equipment and infrastructure that can be exposed or attacked.",
      "value": "asset"
    },
    {
      "description": "Under targeting: the clusters name platforms, such as operating systems.",
      "value": "platform"
    },
    {
      "description": "Under targeting: the clusters name online services that can be exposed or abused.",
      "value": "service"
    },
    {
      "description": "Under context: the clusters name who produced the intelligence - the publisher of a report or a feed.",
      "value": "producer"
    },
    {
      "description": "Under context: the clusters name organisations that appear alongside threat intelligence without being a threat themselves - vendors, agencies, institutions, listed entities.",
      "value": "organisation"
    },
    {
      "description": "Under context: the clusters name branded vulnerabilities - vulnerabilities known by a name rather than only an identifier.",
      "value": "vulnerability"
    },
    {
      "description": "Under context: the clusters are a reference list of sources used alongside threat intelligence - cited reports and publications, IP lists and the like.",
      "value": "reference"
    }
  ],
  "version": 1,
  "description": "The finer distinction inside a galaxy's category - actor vs malware within named-threat, for instance. Each value belongs to one category of galaxy-category, named at the start of its description; the reference category has none. Set on the galaxy definition, not on the cluster, and optional even when category is set.",
  "source": "MISP Project",
  "author": [
    "MISP Project"
  ],
  "uuid": "d76a1ed5-0ec1-46cb-aff9-eb4e8e06dc67",
  "type": "galaxy-sub-category-vocabulary"
}
